ACT_ID,Year,Date,Time,Project,Water_Body,Site_Name,Town,County,Gear,Lat_Start,Long_Start,Survey_location_description,Survey_comments,BS
UNK-Canobie Lake-Salem/Windham,9999,,,UNK,Canobie Lake,,Salem/Windham,,,42.79588131,-71.25524414,Lake centroid,Extirpated due to loss of habitat from shoreline development.,A
UNK-Lamprey River-Bunker Pond-Epping,9999,,,UNK,Lamprey River,Bunker Pond,Epping,,,43.03823985,-71.12955943,Digitized coordinates from 1992 aerial imagery (Google Earth),Bridle shiners were extirpated from the impoundment upstream of the Bunker Pond Dam after its removal in 2011. The river channel that formed in the accumulated sediment upstream of the dam was too shallow to support aquatic vegetation. A remnant bridle shiner population exists in a small manmade pond that drains into the river downstream from the old dam.,A
UNK-Lower Suncook Lake-Barnstead,9999,,,UNK,Lower Suncook Lake,,Barnstead,,,43.37019733,-71.26523831,Lake centroid,"Presumed extirpated. The Suncook Lakes have a long history of intensive milfoil control, drawdowns, and aquatic vegetation loss from shoreline development.",A
UNK-Oyster River-Mill Pond-Durham,9999,,,UNK,Oyster River,Mill Pond,Durham,,,43.130431,-70.92090284,Mill Pond: an impoundment of the Oyster River,"The bridle shiner population in Mill Pond, an impoundment on the Oyster River, was studied extensively by Harrington (1947). The population appears to have been extirpated from the pond, possibly during the construction of a fish ladder, which required draining the impoundment upstream of the dam in the 1970’s.",A
UNK-Pleasant Lake-Deerfield,9999,,,UNK,Pleasant Lake,,Deerfield,,,43.19053025,-71.26006856,Point at northern end of cove: no precise survey location known,Extirpated due to loss of habitat from shoreline development.,A
UNK-Shadow Lake-Salem/Windham,9999,,,UNK,Shadow Lake,,Salem/Windham,,,42.81891546,-71.2393033,Lake centroid,Extirpated due to loss of habitat from shoreline development.,A
UNK-Wheelwright Pond-Lee,9999,,,UNK,Wheelwright Pond,,Lee,,,43.13737961,-71.01073923,Unknown survey location: lat/long point in center of pond,"Noted as present by Harrington (1947), bridle shiners appear to no longer exist in the pond. The cause of extirpation is unknown. Current habitat appears suitable for bridle shiners.",A
UNK-Winnipesaukee Lake-Fish Cove-Meredith,9999,,,UNK,Winnipesaukee Lake,Fish Cove,Meredith,,,43.64422564,-71.43832745,Digitized coordinates: northern end of cove,Presumed extirpated from Fish Cove. The cove has a long history of herbicide treatments to control variable milfoil,A
UNK-Winnisquam Lake-Sanbornton/Laconia/Belmont,9999,,,UNK,Winnisquam Lake,,Sanbornton/Laconia/Belmont,,,43.53961678,-71.50711264,Lake centroid,Extirpated due to loss of habitat from shoreline development.,A
